{
  "schemaVersion": 1,
  "replayId": "replay_015",
  "artifactClass": "death_event_corroboration_evidence",
  "sourceMethod": "temporal_multi_signal_candidate_association",
  "generatedBy": "tools/emit-death-event-corroboration-evidence.mjs",
  "generatedAt": "task_184",
  "rawDataCaptured": false,
  "fieldValuesCaptured": false,
  "rawIdsIncluded": false,
  "rawTicksIncluded": false,
  "rawTimestampsIncluded": false,
  "finalFactsProduced": false,
  "gameplayInterpretationProduced": false,
  "attributionEmitted": false,
  "participantIdentityArtifactFound": true,
  "lifeStateTransitionArtifactFound": true,
  "deathEventCandidateArtifactFound": true,
  "anchorCount": 102,
  "evidenceRowCount": 102,
  "evidenceRows": [
    {
      "corroborationKey": "corroboration_000001",
      "eventCandidateKey": "death_event_candidate_000001",
      "sourceTransitionKey": "life_transition_000001",
      "participantKey": "participant_10",
      "heroRefKey": "hero_ref_05",
      "teamRefKey": "team_ref_07",
      "normalizedElapsedSecond": 46,
      "lifeSignalChangeCandidateObserved": true,
      "normalizedLifeSignalDeltaSecond": 0,
      "pawnLinkChangeCandidateObserved": false,
      "normalizedPawnLinkDeltaSecond": null,
      "respawnSignalChangeCandidateObserved": true,
      "normalizedRespawnSignalDeltaSecond": 0,
      "evidenceClass": "counter_plus_multiple_independent_signals",
      "confirmationStatus": "unconfirmed",
      "finalFact": false
    },
    {
      "corroborationKey": "corroboration_000002",
      "eventCandidateKey": "death_event_candidate_000002",
      "sourceTransitionKey": "life_transition_000002",
      "participantKey": "participant_07",
      "heroRefKey": "hero_ref_12",
      "teamRefKey": "team_ref_07",
      "normalizedElapsedSecond": 91,
      "lifeSignalChangeCandidateObserved": true,
      "normalizedLifeSignalDeltaSecond": 0,
      "pawnLinkChangeCandidateObserved": false,
      "normalizedPawnLinkDeltaSecond": null,
      "respawnSignalChangeCandidateObserved": true,
      "normalizedRespawnSignalDeltaSecond": 0,
      "evidenceClass": "counter_plus_multiple_independent_signals",
      "confirmationStatus": "unconfirmed",
      "finalFact": false
    },
    {
      "corroborationKey": "corroboration_000003",
      "eventCandidateKey": "death_event_candidate_000003",
      "sourceTransitionKey": "life_transition_000003",
      "participantKey": "participant_10",
      "heroRefKey": "hero_ref_05",
      "teamRefKey": "team_ref_07",
      "normalizedElapsedSecond": 91,
      "lifeSignalChangeCandidateObserved": true,
      "normalizedLifeSignalDeltaSecond": 0,
      "pawnLinkChangeCandidateObserved": false,
      "normalizedPawnLinkDeltaSecond": null,
      "respawnSignalChangeCandidateObserved": true,
      "normalizedRespawnSignalDeltaSecond": 0,
      "evidenceClass": "counter_plus_multiple_independent_signals",
      "confirmationStatus": "unconfirmed",
      "finalFact": false
    },
    {
      "corroborationKey": "corroboration_000004",
      "eventCandidateKey": "death_event_candidate_000004",
      "sourceTransitionKey": "life_transition_000004",
      "participantKey": "participant_02",
      "heroRefKey": "hero_ref_01",
      "teamRefKey": "team_ref_13",
      "normalizedElapsedSecond": 112,
      "lifeSignalChangeCandidateObserved": true,
      "normalizedLifeSignalDeltaSecond": 0,
      "pawnLinkChangeCandidateObserved": false,
      "normalizedPawnLinkDeltaSecond": null,
      "respawnSignalChangeCandidateObserved": true,
      "normalizedRespawnSignalDeltaSecond": 0,
      "evidenceClass": "counter_plus_multiple_independent_signals",
      "confirmationStatus": "unconfirmed",
      "finalFact": false
    },
    {
      "corroborationKey": "corroboration_000005",
      "eventCandidateKey": "death_event_candidate_000005",
      "sourceTransitionKey": "life_transition_000005",
      "participantKey": "participant_13",
      "heroRefKey": "hero_ref_11",
      "teamRefKey": "team_ref_07",
      "normalizedElapsedSecond": 140,
      "lifeSignalChangeCandidateObserved": true,
      "normalizedLifeSignalDeltaSecond": 0,
      "pawnLinkChangeCandidateObserved": false,
      "normalizedPawnLinkDeltaSecond": null,
      "respawnSignalChangeCandidateObserved": true,
      "normalizedRespawnSignalDeltaSecond": 0,
      "evidenceClass": "counter_plus_multiple_independent_signals",
      "confirmationStatus": "unconfirmed",
      "finalFact": false
    },
    {
      "corroborationKey": "corroboration_000006",
      "eventCandidateKey": "death_event_candidate_000006",
      "sourceTransitionKey": "life_transition_000006",
      "participantKey": "participant_10",
      "heroRefKey": "hero_ref_05",
      "teamRefKey": "team_ref_07",
      "normalizedElapsedSecond": 168,
      "lifeSignalChangeCandidateObserved": true,
      "normalizedLifeSignalDeltaSecond": 0,
      "pawnLinkChangeCandidateObserved": false,
      "normalizedPawnLinkDeltaSecond": null,
      "respawnSignalChangeCandidateObserved": true,
      "normalizedRespawnSignalDeltaSecond": 0,
      "evidenceClass": "counter_plus_multiple_independent_signals",
      "confirmationStatus": "unconfirmed",
      "finalFact": false
    },
    {
      "corroborationKey": "corroboration_000007",
      "eventCandidateKey": "death_event_candidate_000007",
      "sourceTransitionKey": "life_transition_000007",
      "participantKey": "participant_06",
      "heroRefKey": "hero_ref_10",
      "teamRefKey": "team_ref_13",
      "normalizedElapsedSecond": 242,
      "lifeSignalChangeCandidateObserved": true,
      "normalizedLifeSignalDeltaSecond": 0,
      "pawnLinkChangeCandidateObserved": false,
      "normalizedPawnLinkDeltaSecond": null,
      "respawnSignalChangeCandidateObserved": true,
      "normalizedRespawnSignalDeltaSecond": 0,
      "evidenceClass": "counter_plus_multiple_independent_signals",
      "confirmationStatus": "unconfirmed",
      "finalFact": false
    },
    {
      "corroborationKey": "corroboration_000008",
      "eventCandidateKey": "death_event_candidate_000008",
      "sourceTransitionKey": "life_transition_000008",
      "participantKey": "participant_10",
      "heroRefKey": "hero_ref_05",
      "teamRefKey": "team_ref_07",
      "normalizedElapsedSecond": 244,
      "lifeSignalChangeCandidateObserved": true,
      "normalizedLifeSignalDeltaSecond": 0,
      "pawnLinkChangeCandidateObserved": false,
      "normalizedPawnLinkDeltaSecond": null,
      "respawnSignalChangeCandidateObserved": true,
      "normalizedRespawnSignalDeltaSecond": 0,
      "evidenceClass": "counter_plus_multiple_independent_signals",
      "confirmationStatus": "unconfirmed",
      "finalFact": false
    },
    {
      "corroborationKey": "corroboration_000009",
      "eventCandidateKey": "death_event_candidate_000009",
      "sourceTransitionKey": "life_transition_000009",
      "participantKey": "participant_13",
      "heroRefKey": "hero_ref_11",
      "teamRefKey": "team_ref_07",
      "normalizedElapsedSecond": 320,
      "lifeSignalChangeCandidateObserved": true,
      "normalizedLifeSignalDeltaSecond": 0,
      "pawnLinkChangeCandidateObserved": false,
      "normalizedPawnLinkDeltaSecond": null,
      "respawnSignalChangeCandidateObserved": true,
      "normalizedRespawnSignalDeltaSecond": 0,
      "evidenceClass": "counter_plus_multiple_independent_signals",
      "confirmationStatus": "unconfirmed",
      "finalFact": false
    },
    {
      "corroborationKey": "corroboration_000010",
      "eventCandidateKey": "death_event_candidate_000010",
      "sourceTransitionKey": "life_transition_000010",
      "participantKey": "participant_10",
      "heroRefKey": "hero_ref_05",
      "teamRefKey": "team_ref_07",
      "normalizedElapsedSecond": 321,
      "lifeSignalChangeCandidateObserved": true,
      "normalizedLifeSignalDeltaSecond": 0,
      "pawnLinkChangeCandidateObserved": false,
      "normalizedPawnLinkDeltaSecond": null,
      "respawnSignalChangeCandidateObserved": true,
      "normalizedRespawnSignalDeltaSecond": 0,
      "evidenceClass": "counter_plus_multiple_independent_signals",
      "confirmationStatus": "unconfirmed",
      "finalFact": false
    },
    {
      "corroborationKey": "corroboration_000011",
      "eventCandidateKey": "death_event_candidate_000011",
      "sourceTransitionKey": "life_transition_000011",
      "participantKey": "participant_02",
      "heroRefKey": "hero_ref_01",
      "teamRefKey": "team_ref_13",
      "normalizedElapsedSecond": 321,
      "lifeSignalChangeCandidateObserved": true,
      "normalizedLifeSignalDeltaSecond": 0,
      "pawnLinkChangeCandidateObserved": false,
      "normalizedPawnLinkDeltaSecond": null,
      "respawnSignalChangeCandidateObserved": true,
      "normalizedRespawnSignalDeltaSecond": 0,
      "evidenceClass": "counter_plus_multiple_independent_signals",
      "confirmationStatus": "unconfirmed",
      "finalFact": false
    },
    {
      "corroborationKey": "corroboration_000012",
      "eventCandidateKey": "death_event_candidate_000012",
      "sourceTransitionKey": "life_transition_000012",
      "participantKey": "participant_07",
      "heroRefKey": "hero_ref_12",
      "teamRefKey": "team_ref_07",
      "normalizedElapsedSecond": 347,
      "lifeSignalChangeCandidateObserved": true,
      "normalizedLifeSignalDeltaSecond": 0,
      "pawnLinkChangeCandidateObserved": false,
      "normalizedPawnLinkDeltaSecond": null,
      "respawnSignalChangeCandidateObserved": true,
      "normalizedRespawnSignalDeltaSecond": 0,
      "evidenceClass": "counter_plus_multiple_independent_signals",
      "confirmationStatus": "unconfirmed",
      "finalFact": false
    },
    {
      "corroborationKey": "corroboration_000013",
      "eventCandidateKey": "death_event_candidate_000013",
      "sourceTransitionKey": "life_transition_000013",
      "participantKey": "participant_05",
      "heroRefKey": "hero_ref_09",
      "teamRefKey": "team_ref_07",